<?xml version="1.0"?>
<!DOCTYPE HPT SYSTEM "hpt.dtd">

<HPT version="0.1" info="an HPT (for comm worker enabled) for DaVinci, 2 hex core2 Intel Westmere processors">
    <place num="1" type="mem">
        <place num="1" type="cache"> <!-- socket with common L3 in each -->
            <place num="5" type="cache"> <!-- 6 L2/L1 cache per socket -->
                <worker num="1"/> 
            </place>
        </place>
        <place num="1" type="cache"> <!-- socket with common L3 in each -->
            <place num="6" type="cache"> <!-- 6 L2/L1 cache per socket -->
                <worker num="1"/> 
            </place>
        </place>
        <worker num="1" type="comm"/> <!-- comm worker -->
    </place>
</HPT>
